row_name,Alternative Names,Alternative Names_excerpts,Experimental Evidence for CRM1-mediated Export,Experimental Evidence for CRM1-mediated Export_excerpts,Full Name,Full Name_excerpts,Functional Export Signals,Functional Export Signals_excerpts,GT_NES,GT_NES_excerpts,Mutations That Affect CRM1 Binding,Mutations That Affect CRM1 Binding_excerpts,Mutations That Affect Nuclear Export,Mutations That Affect Nuclear Export_excerpts,Organism,Organism_excerpts,Other Residues Important for Export,Other Residues Important for Export_excerpts,Secondary Structure of Export Signal,Secondary Structure of Export Signal_excerpts,Sequence,Sequence_excerpts,is_NesDB_doubt,is_NesDB_doubt_excerpts
APC Protein,"APC protein, adenomatous polyposis coli",The APC (adenomatous polyposis coli) tumor suppressor protein; APC adenomatous polyposis coli,"Mutagenesis of NES motifs blocks CRM1-dependent nuclear export; treatment with CRM1-specific export inhibitor leptomycin B shifts APC from cytoplasm to nucleus; transient expression of wild-type APC enhances nuclear export of β-catenin, which is blocked by NES mutagenesis.","mutagenesis of these conserved motifs blocks nuclear export dependent on the CRM1 export receptor.; Treatment of cells with the CRM1-specific export inhibitor leptomycin B shifts APC from cytoplasm to nucleus.; Transient expression of wild-type APC in SW480 (APC mut/mut) colon cancer cells enhances nuclear export and degradation of β-catenin, and these effects can be blocked by mutagenesis of the APC NES.",APC,"Mutational inactivation of the APC gene is a key early event...; APC suppresses tumour progression by promoting degradation...; APC gene mutations can lead to abnormally high levels...; Here, we show that APC is a nuclear-cytoplasmic shuttling protein...; APC contains two active nuclear export sequences (NES)...","NES1: 68-78, sequence LLERLKELNLD; NES2: 162-175, sequence LQNLTKRIDS L P L T",one located between amino acids 68–77 (NES1APC) and the other between amino acids 165–174 (NES2APC); APC NES1 (68-LLERLKE L N L D-78); NES2 (162-LQNLTKRIDS L P L T-175),in doubt,Based on source directories: {'../src/full_text_namesDoubt'},mutagenesis of these conserved motifs blocks nuclear export dependent on the CRM1 export receptor.,,['mutagenesis of these conserved motifs blocks nuclear export dependent on the CRM1 export receptor.'],,Human,familial adenomatous polyposis and colon cancer; Transient expression of wild-type APC in SW480 (APC mut/mut) colon cancer cells,L189 and I196 (double mutation L189A/I196A in APC-(129–250) enhances Crm-1 binding by facilitating unmasking of the NES).,"This interaction is enhanced by the small GTPase Ran in its activated GTP-bound form and also by a double mutation in APC-(129–250), which deletes two amino acids forming two of the major interhelical interactions within the coiled coil.; In the mutant APC-(129–250)-L189A/I196A (Fig.4B, mut) two of the main interhelical interactions are abolished, which should improve the unmasking of the NES-(165–174) and the APC-(129–250) binding to Crm-1.","Mainly helical, localized at the C-terminal end of the first helix (helix I).",APC-(129–250) includes the nuclear export signal NES-(165–174) at the C-terminal end of the first helix.; Structurally the NES-(165–174) in APC is mainly helical and localized at the end of helix I of APC-(129–250),,,Although the rodent NES1 sequence does not strictly conform to the NES consensus,
APRIL,"[{'value': 'LANP', 'excerpt': 'Adenovirus E4orf6 targets pp32/LANP to control the fate of ARE-containing mRNAs by perturbing the CRM1-dependent mechanism'}]",,"Leptomycin B sensitivity, nuclear retention",The inhibition of CRM1 by leptomycin B leads to the nuclear retention of pp32 and APRIL,"pp32, APRIL",We show that pp32 and APRIL are nucleocytoplasmic shuttling proteins that interact with the nuclear export factor CRM1 (chromosomal region maintenance protein 1).,,,in doubt,Based on source directories: {'../src/full_text_namesDoubt'},,,,,mammalian,"Here, we identify four mammalian proteins that bind regions of HuR known to be essential for its ability to shuttle between the nucleus and the cytoplasm and to stabilize mRNA: SETα, SETβ, pp32, and acidic protein rich in leucine (APRIL).",,,,,,,,
Actin,"mammalian α-, β- and γ-actin, S.cerevisiae (S.c.) actin","The two putative NES sequences of actin [mammalian α‐, β‐ and γ‐actin and S.cerevisiae (S.c.) actin]; A Saccharomyces cerevisiae act1 (S.c. actin) cDNA was subcloned into pNV7.","Leptomycin B (LMB) sensitivity, nuclear injection and localization assays, mutagenesis of NES sequences, observation of endogenous actin nuclear accumulation upon LMB treatment.","Monomeric actin, when injected into the nucleus, was rapidly exported in a manner which was sensitive to leptomycin B (LMB), a specific inhibitor of NES‐dependent nuclear export.; LMB treatment of cells prevented nuclear exclusion of endogenous actin, inducing its nuclear accumulation.; Furthermore, actin mutants with disrupted NESs accumulated in the nucleus.; Importantly, the nuclear export of both NES‐1–OV and NES‐2–OV was inhibited completely by leptomycin B (LMB); To examine this possibility, we injected tetramethylrhodamine‐labeled actin (TMR‐actin) ... into the nucleus of rat 3Y1 cells.; Indirect immunofluorescent staining showed that before treatment with LMB, actin was present almost exclusively in the cytoplasm; After LMB treatment, actin became localized to the nucleus in all cells; we made three mutant actins in which critical hydrophobic residues (the third and fourth hydrophobic residue) in either NES‐1 or NES‐2, or both were replaced by alanines to disrupt NES‐1, NES‐2 or both",Actin,Actin is a major cytoskeletal element and is normally kept cytoplasmic by exportin 6 (Exp6)-driven nuclear export.,NES-1: residues 170–181 (ALPHAIMRLDLA). NES-2: residues 211–222 (DIKEKLCYVALD).,"NES‐1, residues 170–181; NES‐2, residues 211–222; The NES‐1 peptide corresponding to residues 170–181 (ALPHAIMRLDLA) of actin and the NES‐2 peptide corresponding to residues 211–222 (DIKEKLCYVALD) of actin were synthesized",in doubt,Based on source directories: {'../src/full_text_namesDoubt'},,,NES-1 disrupted: Ile-178 to Ala and Leu-180 to Ala (in S.c. actin). NES-2 disrupted: Val-219 to Ala and Leu-221 to Ala (in S.c. actin). Double mutant (disNES-1&2) with both sets of mutations.,"we made three mutant actins in which critical hydrophobic residues (the third and fourth hydrophobic residue) in either NES‐1 or NES‐2, or both were replaced by alanines to disrupt NES‐1, NES‐2 or both, respectively (disNES‐1, disNES‐2, or disNES‐1&2 in Figure 4A).; Mutagenesis of Ile‐178 to Ala and Leu‐180 to Ala in S.c. actin was performed ... to yield disNES‐1 actin.; To obtain disNES‐2 actin (V219A/L221A actin) and disNES‐1&2 actin, mutagenic primers 5′‐GAAAAACTATGTTACGCCGCCGCGGACTTCGAACAAG‐3′ and 5′‐CTTGTTCGAAGTCCGCGGCGGCGTAA‐ CATAGTTTTTC‐3′ were used.",Xenopus laevis,microinjected actin was not exported from Xenopus laevis oocyte nuclei; Xenopus oocytes lack Exp6,,,Both NES-1 and NES-2 portions appear to be exposed at the exterior of the actin monomer.,"The NES‐1 (yellow, with the critical hydrophobic residues in green) portion and the NES‐2 (yellow, with the critical hydrophobic residues in red) portion seem to be exposed at the exterior.; It is inferred from the tertiary structure of the actin molecule ... that both NES‐1 and NES‐2 are located on the surface (Figure 1C).",,,,
CDC27,"[{'name': 'B23', 'excerpt': 'For nucleophosmin (also called B23 or NO38), we measured a nuclear concentration of ≈ 2.3 µM, a cytoplasmic concentration of 8 nM, and hence a nucleocytoplasmic (N:C) partition coefficient of 300:1.'}, {'name': 'NO38', 'excerpt': 'For nucleophosmin (also called B23 or NO38), we measured a nuclear concentration of ≈ 2.3 µM, a cytoplasmic concentration of 8 nM, and hence a nucleocytoplasmic (N:C) partition coefficient of 300:1.'}]",,Cellular assays based on reporter protein localization (SRV_B/A_ assay and Rev(1.4)-GFP assay) were used to identify and validate nuclear export activity.,"Using cellular assays, we first map 19 new sequence motifs with nuclear export activity in 14 cancer-related proteins that are potential CRM1 cargos.; The Rev(1.4)-GFP assay was used first to evaluate export activity of all Rank 1 motifs.; Next, a subset of 22 motifs with different 1.4 scores were subcloned into the SRV_B/A_ plasmid. These reporters were transfected into HEK293T cells either alone or with YFP-CRM1 and, after anti-Flag immunostaining, their localization was globally assessed by fluorescence microscopy and classified as exclusively nuclear (N), mainly nuclear (N > C), nuclear and cytoplasmic (NC), mainly cytoplasmic (C > N) or exclusively cytoplasmic (C) (assessment method 1, detailed in Figure 1).; In summary, we have experimentally validated 25 sequence motifs with nuclear export activity in “XPO1/CRM1-cancer exportome” proteins, 19 of which represent novel “plus” or “minus” potential NESs not previously described. Furthermore, these results validate the use of the SRV_B/A_ reporter as a tool to search for novel NESs.",CDC27,"14 proteins (SPN90, TFE3, SHIP2, PER1, SEPT6, SIR2, UBR5, FR1OP, AP2B1, IF2B, mTOR, CRTC1, CDC27 and ZO2, see Supplementary Figure S1)","[{'protein_name': 'SHIP2', 'signal_name': 'WN6', 'start_index': 256, 'end_index': 274, 'excerpt': 'A particularly noteworthy case is the SHIP2 protein, where two overlapping putative NES motifs were predicted, one as “plus” (WN6: 256- TGEQELESLVLKLSVLKDF-274) and the other as “minus” (REV5: 261-LESLVLKLSVLKDFLSGIQ-279). Both motifs displayed similar export activity in our assays.'}, {'protein_name': 'SHIP2', 'signal_name': 'REV5', 'start_index': 261, 'end_index': 279, 'excerpt': 'A particularly noteworthy case is the SHIP2 protein, where two overlapping putative NES motifs were predicted, one as “plus” (WN6: 256- TGEQELESLVLKLSVLKDF-274) and the other as “minus” (REV5: 261-LESLVLKLSVLKDFLSGIQ-279). Both motifs displayed similar export activity in our assays.'}, {'protein_name': 'SPROHSA141543', 'signal_name': 'MICROP-5', 'start_index': 30, 'end_index': 36, 'excerpt': ""These findings identify at least two clearly active NES motifs (MICROP-5 and MICROP-7) in human micropeptides. ... To our knowledge, these sequences (Figure 5D) represent the first two functional CRM1-dependent NESs identified in human micropeptides. ... Figure 5D. ... Schematic representation of human micropeptides SPROHSA141543 and SPROHSA010409 (SmProt IDs), showing the position of the novel NESs identified. The amino acid sequence of the NES motifs is indicated, with the hydrophobic residues that conform to the NES consensus highlighted in green. [Figure 5D shows SPROHSA141543 (MICROP-5) with NES 'LSLVLLK' at positions 30-36]""}, {'protein_name': 'SPROHSA010409', 'signal_name': 'MICROP-7', 'start_index': 30, 'end_index': 36, 'excerpt': ""These findings identify at least two clearly active NES motifs (MICROP-5 and MICROP-7) in human micropeptides. ... To our knowledge, these sequences (Figure 5D) represent the first two functional CRM1-dependent NESs identified in human micropeptides. ... Figure 5D. ... Schematic representation of human micropeptides SPROHSA141543 and SPROHSA010409 (SmProt IDs), showing the position of the novel NESs identified. The amino acid sequence of the NES motifs is indicated, with the hydrophobic residues that conform to the NES consensus highlighted in green. [Figure 5D shows SPROHSA010409 (MICROP-7) with NES 'LSLVLLK' at positions 30-36]""}]",,in doubt,Based on source directories: {'../src/full_text_namesDoubt'},,,"A fourth reporter, containing an export-deficient version of survivin NES mutated in two critical hydrophobic residues [19] was also included for comparison in these assays.",,Human,"About 200 NES motifs have been identified, but over a thousand human proteins are potential CRM1 cargos, and most of their NESs remain to be identified.; By combining the “CRM1-dependent nuclear exportome” protein set [6] with the subset of “Cancer-related gene” entries of the Human Protein Atlas (https://www.proteinatlas.org/), we recently proposed the term “XPO1/CRM1-cancer exportome” [13] to refer to a group of 136 cancer-related proteins that are known or potential CRM1 cargos (Supplementary Table S1).; 14 proteins (SPN90, TFE3, SHIP2, PER1, SEPT6, SIR2, UBR5, FR1OP, AP2B1, IF2B, mTOR, CRTC1, CDC27 and ZO2, see Supplementary Figure S1) that belong to a putative “XPO1/CRM1-cancer exportome”.","Cyclin B's NES is inactivated by phosphorylation of adjacent serine residues, leading to nuclear accumulation.",,"Structural studies have shown that NES peptides dock into the groove with different backbone conformations, varying from all helix to an almost fully extended conformation.",,,,"Yes, the role of the identified motif as a bona-fide NES needs further validation, as its accessibility for CRM1 binding in the context of the cognate full-length protein is not yet established.","The role of each of the identified motifs as bona-fide NESs needs to be validated, as some of these sequences might not be accessible for CRM1 binding in the context of their cognate full-length proteins."
CEP43,"[{'name': 'B23', 'excerpt': 'For nucleophosmin (also called B23 or NO38), we measured a nuclear concentration of ≈ 2.3 µM, a cytoplasmic concentration of 8 nM, and hence a nucleocytoplasmic (N:C) partition coefficient of 300:1.'}, {'name': 'NO38', 'excerpt': 'For nucleophosmin (also called B23 or NO38), we measured a nuclear concentration of ≈ 2.3 µM, a cytoplasmic concentration of 8 nM, and hence a nucleocytoplasmic (N:C) partition coefficient of 300:1.'}]",,"['Cellular assays based on the localization of reporter proteins (e.g., Rev(1.4)-GFP nuclear export assay, SRV100 assay, SRV B/A assay, transfection-based cellular assays)', 'Structural analyses', 'Biochemical analyses (including determination of K d values for CRM1/NES interaction)', 'Leptomycin B (LMB) sensitivity (e.g., nuclear export of MICROP-5 NES motif is blocked by LMB)', 'Mutagenesis (e.g., simultaneous mutations in hydrophobic residues abrogating YFP-CRM1-induced export)']",,"['MAP kinase kinase 2', 'cancer susceptibility candidate gene 3 protein', 'period circadian protein homolog 1', 'PKI', 'PAX', 'HDAC5', 'FMRP', 'FMRP-1b', 'SNUPN', 'Rev', 'SMAD4', 'mDia2', 'CDC7', 'X11L2', 'CPEB4', 'hRio2', 'COMMD1', 'Hxk2', 'DEAF1', 'survivin', 'SPN90', 'TFE3', 'SHIP2', 'SEPT6', 'SIR2', 'UBR5', 'FR1OP', 'AP2B1', 'IF2B', 'mTOR', 'CRTC1', 'ZO2']",,"[{'protein_name': 'SHIP2', 'signal_name': 'WN6', 'start_index': 256, 'end_index': 274, 'excerpt': 'A particularly noteworthy case is the SHIP2 protein, where two overlapping putative NES motifs were predicted, one as “plus” (WN6: 256- TGEQELESLVLKLSVLKDF-274) and the other as “minus” (REV5: 261-LESLVLKLSVLKDFLSGIQ-279). Both motifs displayed similar export activity in our assays.'}, {'protein_name': 'SHIP2', 'signal_name': 'REV5', 'start_index': 261, 'end_index': 279, 'excerpt': 'A particularly noteworthy case is the SHIP2 protein, where two overlapping putative NES motifs were predicted, one as “plus” (WN6: 256- TGEQELESLVLKLSVLKDF-274) and the other as “minus” (REV5: 261-LESLVLKLSVLKDFLSGIQ-279). Both motifs displayed similar export activity in our assays.'}, {'protein_name': 'SPROHSA141543', 'signal_name': 'MICROP-5', 'start_index': 30, 'end_index': 36, 'excerpt': ""These findings identify at least two clearly active NES motifs (MICROP-5 and MICROP-7) in human micropeptides. ... To our knowledge, these sequences (Figure 5D) represent the first two functional CRM1-dependent NESs identified in human micropeptides. ... Figure 5D. ... Schematic representation of human micropeptides SPROHSA141543 and SPROHSA010409 (SmProt IDs), showing the position of the novel NESs identified. The amino acid sequence of the NES motifs is indicated, with the hydrophobic residues that conform to the NES consensus highlighted in green. [Figure 5D shows SPROHSA141543 (MICROP-5) with NES 'LSLVLLK' at positions 30-36]""}, {'protein_name': 'SPROHSA010409', 'signal_name': 'MICROP-7', 'start_index': 30, 'end_index': 36, 'excerpt': ""These findings identify at least two clearly active NES motifs (MICROP-5 and MICROP-7) in human micropeptides. ... To our knowledge, these sequences (Figure 5D) represent the first two functional CRM1-dependent NESs identified in human micropeptides. ... Figure 5D. ... Schematic representation of human micropeptides SPROHSA141543 and SPROHSA010409 (SmProt IDs), showing the position of the novel NESs identified. The amino acid sequence of the NES motifs is indicated, with the hydrophobic residues that conform to the NES consensus highlighted in green. [Figure 5D shows SPROHSA010409 (MICROP-7) with NES 'LSLVLLK' at positions 30-36]""}]",,in doubt,Based on source directories: {'../src/full_text_namesDoubt'},,,"A fourth reporter, containing an export-deficient version of survivin NES mutated in two critical hydrophobic residues [19] was also included for comparison in these assays.",,human,,Phosphorylation of adjacent serine residues (in Cyclin B) can inactivate the NES; phosphorylation (in PHAX) is required for efficient interaction with CRM1.,"Cyclin B, for example, is kept cytoplasmic by CRM1 until prophase, when the NES gets inactivated by phosphorylation of adjacent serine residues and the protein suddenly accumulates inside nuclei (Yang et al., 1998).; PHAX, the export adapter for U snRNAs, on the other hand, requires phosphorylation for an efficient interaction with CRM1 (Kitao et al., 2008).","Structural studies have shown that NES peptides dock into the groove with different backbone conformations, varying from all helix to an almost fully extended conformation.",,,,This observation is in marked contrast with the reduced nuclear export activity of the superPKI NES previously reported.,
CRTC1,"[{'name': 'B23', 'excerpt': 'For nucleophosmin (also called B23 or NO38), we measured a nuclear concentration of ≈ 2.3 µM, a cytoplasmic concentration of 8 nM, and hence a nucleocytoplasmic (N:C) partition coefficient of 300:1.'}, {'name': 'NO38', 'excerpt': 'For nucleophosmin (also called B23 or NO38), we measured a nuclear concentration of ≈ 2.3 µM, a cytoplasmic concentration of 8 nM, and hence a nucleocytoplasmic (N:C) partition coefficient of 300:1.'}]",,"Cellular assays based on reporter protein localization (Rev(1.4)-GFP and SRV B/A assays), assessed by fluorescence microscopy, and co-expression with YFP-CRM1 wild-type.","The Rev(1.4)-GFP assay was used first to evaluate export activity of all Rank 1 motifs.; Next, a subset of 22 motifs with different 1.4 scores were subcloned into the SRV B/A plasmid. These reporters were transfected into HEK293T cells either alone or with YFP-CRM1 and, after anti-Flag immunostaining, their localization was globally assessed by fluorescence microscopy; Both motifs displayed similar export activity in our assays.",SHIP2 protein,"A particularly noteworthy case is the SHIP2 protein, where two overlapping putative NES motifs were predicted",WN6: 256-TGEQELESLVLKLSVLKDF-274 (plus motif); REV5: 261-LESLVLKLSVLKDFLSGIQ-279 (minus motif),"A particularly noteworthy case is the SHIP2 protein, where two overlapping putative NES motifs were predicted, one as “plus” (WN6: 256- TGEQELESLVLKLSVLKDF-274) and the other as “minus” (REV5: 261-LESLVLKLSVLKDFLSGIQ-279).",in doubt,Based on source directories: {'../src/full_text_namesDoubt'},,,"A fourth reporter, containing an export-deficient version of survivin NES mutated in two critical hydrophobic residues [19] was also included for comparison in these assays.",,Human,map 19 new sequence motifs with nuclear export activity in 14 cancer-related proteins that are potential CRM1 cargos.; the first NES-harboring human micropeptides.,"Cyclin B's NES is inactivated by phosphorylation of adjacent serine residues, leading to nuclear accumulation.",,"Structural studies have shown that NES peptides dock into the groove with different backbone conformations, varying from all helix to an almost fully extended conformation.",,,,"The role of identified motifs as bona-fide NESs needs further validation, as some sequences might not be accessible for CRM1 binding in the context of their cognate full-length proteins.","The role of each of the identified motifs as bona-fide NESs needs to be validated, as some of these sequences might not be accessible for CRM1 binding in the context of their cognate full-length proteins."
DDX6,DDX6,Xp54 belongs to small family of helicases (DDX6) that associate with mRNA molecules encoding proteins required for progress through meiosis.,Leptomycin B sensitivity,"Translocation of Xp54 from the nucleus to the cytoplasm appears to be dependent on the presence of a leucine-rich nuclear export signal (NES) and is blocked by leptomycin B, a specific inhibitor of the CRM1 receptor pathway.",Xp54,"Previously, we showed that an integral component of stored mRNP particles in Xenopus oocytes, Xp54, is a DEAD-box RNA helicase with ATP-dependent RNA-unwinding activity.",,,in doubt,Based on source directories: {'../src/full_text_namesDoubt'},mutation at the putative NES,,"['All NES mutants (mNES) bear L158A/L160A substitutions.', 'As expected, the export of YFP-DDX6 1–166 was sensitive to LMB treatment and to mutation at the putative NES (Fig. 3d and e).']",,Xenopus oocytes,"Previously, we showed that an integral component of stored mRNP particles in Xenopus oocytes, Xp54, is a DEAD-box RNA helicase with ATP-dependent RNA-unwinding activity.","The putative nuclear export signal (NES) in DDX6 is buried inside the core region of the DDX6 NTD, with L151 and L155 directly blocked by the 174–199 segment. The recognition and shuttling of the Xp54 1–164 segment by CRM1 results from the removal of the downstream masking peptide segments, which exposes the putative NES.",,α-helical folding,,,,"The paper provides strong evidence that the previously proposed (putative) NES in full-length DDX6 is not functional. It is structurally masked and inaccessible to CRM1, and full-length DDX6 is insensitive to LMB treatment, which inhibits CRM1-dependent export.","the evidence for the putative NES is unconvincing; there are conflicting data in the current literature.; We show that the putative NES is masked by protein folding, resulting in its inaccessibility to CRM1, the mediator protein for the L-rich NES-dependent export.; DDX6 itself is insensitive to LMB treatment; it cannot be exported via the CRM1 pathway with the putative NES"
