ADD1,ADD1 (α isoform),ADD1 (α isoform),"Leptomycin A sensitivity, localization assays, deletion mutagenesis","in the presence of leptomycin A (LMA), a specific inhibitor for the nucleocytoplasmic translocation of proteins containing an NES (24,25), α-adducin was sequestered in the nucleus and unable to redistribute to cell–cell junctions (Figure 3A).; leptomycin caused sequestration of α-adducin in the nucleus; GFP-α-adducin was localized to the cytoplasm and nucleus, which can be sequestered in the nucleus by leptomycin (Figure 6C).; Indeed, deletion of this motif (aa 377–391) caused α-adducin to localize in the nucleus (Figure 6C).",α-adducin,we demonstrate that α-adducin is mainly localized in the nucleus of sparsely cultured epithelial cells; we identify that α-adducin contains a bipartite nuclear localization signal (NLS) in its COOH-terminal tail domain and a nuclear export signal in its neck region.,LMRMLDNL (amino acids 380-387),"We noticed that a leucine-rich sequence (380LMRMLDNL387) in a motif of LX(2−3)LX(2−3)-L is present in the neck region, which resembles an NES.; Indeed, deletion of this motif (aa 377–391) caused α-adducin to localize in the nucleus (Figure 6C).",yes,Based on source directories: {'../src/full_text'},"Deletion of the leucine-rich sequence (FEALMRMLDWLGYRT) in the neck domain of ADD1 abolished the nuclear export capability of its neck domain, indicating this motif is the only NES in that domain. The nuclear export of ADD1 is mainly CRM1-dependent.",,Deletion of amino acids 377–391,"Indeed, deletion of this motif (aa 377–391) caused α-adducin to localize in the nucleus (Figure 6C).","Human, Canine, Mouse",α-adducin was predominantly localized to the nucleus of sparsely cultured epithelial cells including Madin-Darby canine kidney (MDCK) cells; human epidermal A431 cells; human breast epithelial MCF7 cells; GFP-α-adducin or its mutants (K718A/K719A and K730A/K732A) were transiently expressed in NIH3T3 fibroblasts; GFP-α-adducin and its mutants were transiently expressed in HEK293 cells.,[{'excerpt': 'These data also indicate that the head domain of α-adducin may be able to modulate the effect of the NES.'}],,Large portions of the traditional consensus patterns for nuclear export signals (NESs) essentially describe the amphipathic helix.,,,,excluding the possibility of these two leucine-rich sequences functioning as an NES in α-adducin.,
AP1-gamma,"[{'name': 'B23', 'excerpt': 'For nucleophosmin (also called B23 or NO38), we measured a nuclear concentration of ≈ 2.3 µM, a cytoplasmic concentration of 8 nM, and hence a nucleocytoplasmic (N:C) partition coefficient of 300:1.'}, {'name': 'NO38', 'excerpt': 'For nucleophosmin (also called B23 or NO38), we measured a nuclear concentration of ≈ 2.3 µM, a cytoplasmic concentration of 8 nM, and hence a nucleocytoplasmic (N:C) partition coefficient of 300:1.'}]",,"Leptomycin B sensitivity (GFP-fusion shifted from cytoplasmic to nucleocytoplasmic equilibrium), localization assays (GFP-NLS-eRF3a fusion remained cytoplasmic in undisturbed cells, indicating faster export than strong NLS-mediated import), and direct CRM1-binding in a RanGTP-dependent manner.","Its GFP-fusion was exclusively cytoplasmic in transfected HeLa cells (Figure 4), which is consistent with its experimentally determined localisation in Xenopus oocytes (Supplementary file 1). A CRM1-block by 10 nM leptomycin B, however, caused the fusion to equilibrate between nucleus and cytoplasm, suggesting a significant nuclear entry rate and rapid CRM1-dependent retrieval in undisturbed cells.; In undisturbed cells, however, we observed a still nearly exclusively cytoplasmic localisation, suggesting that the eRF3a NES confers a considerably faster export from nuclei than nuclear import mediated by the (very strong) SV40 NLS.; eRF3a binds also purified CRM1 in a RanGTP-dependent manner (Figure 5), suggesting that the interaction is direct and not bridged by another factor.",Xenopus translation termination factor eRF3a,The first was the Xenopus translation termination factor eRF3a.,Within the N-terminal unstructured region of eRF3a.,We identified this NES within the N-terminal unstructured region of eRF3a and confirmed its nuclear export activity by transfection assays as well (Figure 4).,yes,Based on source directories: {'../src/full_text'},,,,,Xenopus laevis,The first was the Xenopus translation termination factor eRF3a.,"Cyclin B's NES is inactivated by phosphorylation of adjacent serine residues, leading to nuclear accumulation.",,Unstructured region,We identified this NES within the N-terminal unstructured region of eRF3a,,,NES prediction will therefore remain unreliable and produce frequent false-positive hits as long as it is based on an unreliable list of positive cases.,
ATG3,"[{'name': 'B23', 'excerpt': 'For nucleophosmin (also called B23 or NO38), we measured a nuclear concentration of ≈ 2.3 µM, a cytoplasmic concentration of 8 nM, and hence a nucleocytoplasmic (N:C) partition coefficient of 300:1.'}, {'name': 'NO38', 'excerpt': 'For nucleophosmin (also called B23 or NO38), we measured a nuclear concentration of ≈ 2.3 µM, a cytoplasmic concentration of 8 nM, and hence a nucleocytoplasmic (N:C) partition coefficient of 300:1.'}]",,"Leptomycin B sensitivity, localization assays (GFP-fusion), binding assays (RanGTP-dependent binding to purified CRM1), transfection assays (for NES activity).","Its GFP-fusion was exclusively cytoplasmic in transfected HeLa cells (Figure 4)... A CRM1-block by 10 nM leptomycin B, however, caused the fusion to equilibrate between nucleus and cytoplasm, suggesting a significant nuclear entry rate and rapid CRM1-dependent retrieval in undisturbed cells.; We identified this NES within the N-terminal unstructured region of eRF3a and confirmed its nuclear export activity by transfection assays as well (Figure 4).; eRF3a binds also purified CRM1 in a RanGTP-dependent manner (Figure 5), suggesting that the interaction is direct and not bridged by another factor.",Xenopus translation termination factor eRF3a,The first was the Xenopus translation termination factor eRF3a.,,,yes,Based on source directories: {'../src/full_text'},,,,,Xenopus,The first was the Xenopus translation termination factor eRF3a.,"Cyclin B's NES is inactivated by phosphorylation of adjacent serine residues, leading to nuclear accumulation.",,Unstructured region,We identified this NES within the N-terminal unstructured region of eRF3a...,,,NES prediction will therefore remain unreliable and produce frequent false-positive hits as long as it is based on an unreliable list of positive cases.,
BRCA1,"Brca1 (gene), BRCA1Δ11b (splice variant), BRCA1Δ672–4095 (splice variant)","Germ-line mutations in the tumor suppressor gene Brca1 confer increased susceptibility to breast and ovarian cancers.; BRCA1 is a 1863-amino acid protein; BRCA1 splice variants, such as the commonly expressed isoforms BRCA1Δ11b (11) or BRCA1Δ672–4095 (12), that lack the NLSs and are localized to the cytoplasm.","Leptomycin B (LMB) sensitivity, localization assays (immunofluorescence microscopy), mutagenesis of NES, overexpression of CRM1 export receptor, Rev(1.4)-GFP export assay.","Mutational inactivation of this nuclear export sequence, or treatment of cells with the CRM1-specific export inhibitor leptomycin B, induced nuclear accumulation of ectopic full-length BRCA1.; Moreover, overexpression of the CRM1 export receptor resulted in decreased nuclear localization of endogenous BRCA1.; We also show that the NH2-terminal peptide 81QLVEELLKIICAFQLDTGL99 constitutes an active Rev-type nuclear export sequence (NES) that mediates CRM1-dependent export of BRCA1.; The in vivo export assay used in this study has been recently described in detail (22). This assay is based on the ability of functional export sequences to restore the nuclear export activity of the chimeric protein Rev(1.4)-GFP, a fusion of an NES-deficient mutant HIV Rev protein and GFP.; Cells expressing YFP- or GFP-tagged proteins were fixed with 3.7% formaldehyde in PBS for 15 min at room temperature, washed, and mounted for direct detection of the autofluorescent proteins. Untagged ectopic BRCA1 was detected by immunofluorescence using monoclonal antibodies Ab1 (Oncogene Research) or D9 (Santa Cruz), which recognize an amino- or carboxyl-terminal epitope of BRCA1, respectively.",BRCA1,BRCA1 is a 1863-amino acid protein with roles in transcriptional regulation and the cellular responses to DNA damage.; We identified a functional Rev-type nuclear export sequence (81QLVEELLKIICAFQLDTGL) near the amino terminus of BRCA1 that facilitates export via the CRM1/exportin pathway.,81QLVEELLKIICAFQLDTGL99,"We identified a functional Rev-type nuclear export sequence (81QLVEELLKIICAFQLDTGL) near the amino terminus of BRCA1 that facilitates export via the CRM1/exportin pathway.; Only the 81QLVEELLKIICAFQLDTGL99 motif induced the cytoplasmic relocation of Rev(1.4)-GFP after actinomycin D treatment (see BRCA1 NES in Fig. 4), a shift that was fully blocked by LMB (data not shown). These results confirmed that this sequence motif constitutes a functional NES, whereas the other two NES-like sequences in BRCA1 do not function as export signals.",yes,Based on source directories: {'../src/full_text'},"['Alanine substitutions of the hydrophobic residues that conform to the consensus Rev-type NES sequence (m1 and m2) abrogate the ability of BRCA1 NES to promote export of Rev(1.4)-GFP. Mutation of Leu86 and Ile90 (mutant m1) or Phe93 and Leu95 (mutant m2) to alanine completely abrogated export activity.', 'The NES-defective BRCA1 mutant BRCA1NESm1 was created by introducing the NES-inactivating alanine substitutions of Leu86 and Ile90 into the full-length BRCA1 cDNA. Inactivation of the BRCA1 NES increased the nuclear localization of the fusion protein in all cell lines. LMB treatment of transfected cells revealed that BRCA1 shuttling was completely abolished by the NES mutation in T47D cells and greatly reduced in MCF-7 and NIH3T3 cells.']",,Alanine substitutions of Leu86 and Ile90 (mutant m1) completely abrogated export activity. Alanine substitutions of Phe93 and Leu95 (mutant m2) also completely abrogated export activity.,"Mutation of Leu86 and Ile90 (mutant m1) or Phe93 and Leu95 (mutant m2) to alanine completely abrogated export activity, whereas mutation of leucines outside the “core” NES (mutant m3) had only a minor effect (Fig. 6).; The codons in bold in the oligo BH9848 (Table I) encode the alanine residues replacing BRCA1 NES amino acids Leu86 and Ile90.","Human (protein), characterized in human breast cancer cell lines (T47D, MCF-7), human breast epithelial cell line (HBL-100), and mouse NIH3T3 fibroblasts.","The human Brca1 gene encodes a 1863-amino acid protein; Human breast cancer cell lines T47D and MCF-7, the human breast epithelial cell line HBL-100, and mouse NIH3T3 fibroblasts were maintained in Dulbe's modified Eagle's medium supplemented with 10% fetal calf serum.","Mutation of leucines outside the “core” NES (mutant m3) had only a minor effect on export activity, suggesting these flanking hydrophobic residues may play a minor role.","Mutation of Leu86 and Ile90 (mutant m1) or Phe93 and Leu95 (mutant m2) to alanine completely abrogated export activity, whereas mutation of leucines outside the “core” NES (mutant m3) had only a minor effect (Fig. 6).",,,,,"No doubt; the NES is described as functional, highly conserved, and its activity was experimentally validated and characterized.","We identified a functional Rev-type nuclear export sequence (81QLVEELLKIICAFQLDTGL) near the amino terminus of BRCA1 that facilitates export via the CRM1/exportin pathway.; These results confirmed that this sequence motif constitutes a functional NES, whereas the other two NES-like sequences in BRCA1 do not function as export signals.; The large hydrophobic amino acids in the BRCA1 export sequence that conform to the consensus NES spacing are well conserved between species (Fig. 5).; In the 1+ to 9+ scoring system for NES activity, the BRCA1 NES was rated as 5+."
Bach1,,,"Leptomycin B (LMB) sensitivity, LMB insensitivity with Crm1-K1 mutant, Crm1 binding assay (GST pull-down), and subcellular localization assays.","This region functioned as a heme-regulated NES dependent on the exporter Crm1.; This conditional nuclear export of GFP-GST-B1(417–587) was inhibited by treatment with LMB when coexpressed with the wild-type hCrm1.; However, when cotransfected with hCrm1-K1, GFP-GST-B1(417–587) was localized within the cytoplasmic region and excluded from the nucleus even in the presence of LMB.; To examine whether Bach1 binds to Crm1, a GST–Bach1 fusion protein (residues 417–645 containing CP3–5) was charged with hemin and then incubated with liver cell extracts. As shown in Figure 6C, a small but significant fraction of Crm1 bound to the GST–Bach1 fragment.; heme clearly induced cytoplasmic accumulation and exclusion from the nuclear region.",Bach1,Bach1 is a transcriptional repressor of heme oxygenase‐1 and β‐globin genes...; Bach1 accumulates within the cytoplasmic region when overexpressed alone in a cell...,Amino-acid residues 436–471,the minimal hemin-responsive region encompassed amino-acid residues 436–471.; the region between residues 436 and 471 functions as a heme-dependent NES,yes,Based on source directories: {'../src/full_text'},"Cys-to-Ala/Pro mutations in CP3 (mCP3AP) and CP3,4 (mCP34AP) abolish heme-Bach1 interaction, which is critical for the heme-regulated interaction with Crm1.","The simplest model is that this region is involved in a heme-regulated interaction with Crm1 that mediates nuclear export.; mCP3AP mutation and mCP34AP double mutations did not show a Soret band at 371 nm (Figure 8, bottom panel, and data not shown), indicating that these mutations abolished heme–Bach1 interaction.; We conclude that at least CP3 in NES is critically involved in the interaction with heme.","Cys-to-Ala changes in all CP motifs (Bach1mCP1–6), Cys-to-Ala changes in CP3, 4, 5, 6 (mCP3456), Cys-to-Ala changes in CP3, 4 (mCP34), Cys-to-Ala change in CP3 (GFP-B1(417–587)mCP3), Cys-to-Ala change in CP4 (GFP-B1(417–587)mCP4), alanine scanning mutagenesis of hydrophobic residues (mut 1), deletions of CP3 or CP4 (fragments 430–460 or 440–471), and mutations in CP motifs on fragment 436-471.","Bach1mCP1–6, carrying Cys-to-Ala changes in all of the CP motifs...; Bach1mCP1–6 remained in the nuclei even following the addition of hemin to the medium.; mCP3456 completely lacked a heme response.; mCP34 also showed little response to heme.; GFP-B1(417–587)mCP3 was not relocalized to the cytoplasm even after hemin treatment.; GFP-B1(417–587)mCP4 displayed an intermediate response.; We replaced the hydrophobic residues with alanine using GFP-B1(417–587) (Figure 7A; mut 1, 2, and 3). Among the three clustered mutations examined here, only mut 1 completely abolished hemin-induced nuclear export.; Deletions of either CP3 or 4 (430–460 or 440–471) completely abolished hemin-induced nuclear exclusion.; mutations in the CP motifs completely abolished hemin-induced nuclear exclusion.",Human (293T and GM02063 cells),expressed wild type and mutated versions of Bach1 together with or without its heterodimer partner MafK in human 293T and GM02063 cells; Human fibroblast GM02063 cells were transfected with FLAG‐tagged Bach1 or Bach1mCP derivative expression plasmids...,"Heme-binding motifs CP3 and CP4, and hydrophobic residues juxtaposing CP3 (mut 1).","a region containing two of the heme‐binding motifs was found to be critical for the heme‐induced nuclear exclusion.; CP3 and 4 are critical and sufficient for heme‐induced nuclear exclusion.; several hydrophobic residues juxtaposing the critical CP3 and 4 regions (see Figure 7A, shown with lines above the sequence).; Among the three clustered mutations examined here, only mut 1 completely abolished hemin-induced nuclear export.; the CP3 and 4 motifs are both involved in this function.",,,,,"While Crm1 bound to Bach1 in GST pull‐down assays (Figure 6), we still do not know whether the interaction is direct or not.",
CCTα,"CCT, CTP:phosphocholine cytidylyltransferase",cytidyltransferase (CCTα); CTP:phosphocholine cytidylyltransferase (CCT),"['Leptomycin B (LMB) sensitivity', 'Localization assays (CFP-CCTα mutant lacking NES, isolated CFP-NES peptide)', 'Co-immunoprecipitation', 'Fluorescence Resonance Energy Transfer (FRET) analysis', 'Pull-down assays with recombinant CRM1 and CCTα', 'Isothermal titration calorimetry (ITC)']","CRM1/exportin 1 was required for CCTα nuclear export, and its overexpression in cells was partially sufficient to trigger CCTα nuclear export despite calcium stimulation.; An isolated CFP-290-299 peptide remained in the nucleus in the presence of leptomycin B but was able to target to the cytoplasm with farnesol.; Expression of a CFP-CCTα mutant lacking residues 290–299 in cells results in cytosolically retained enzyme.; we also demonstrate interactions between CCTα and CRM1, a classic exporter of cargo proteins from the nucleus to the cytoplasm.; we first treated cells with or without Ca2+ and then performed coimmunoprecipitations using CCTα and CRM1 antibodies followed by immunoblotting (Figure 7A).; In cells, interaction between CCTα and CRM1 was also seen using FRET analysis (Figure 7B).; Furthermore, we observed direct binding between CCTα and CRM1 in pull-down assays using purified recombinant CRM1 and Talon resin–conjugated CCTα that was induced by RanGTP and blocked by leptomycin B (LMB; Figure 7C).; These observations were supported with ITC, indicating that binding affinities between CRM1 and a peptide fragment from the CCTα membrane-binding sequence (Kd = 0.4 μM) were comparable with CCTα interaction with CaMKI (Figures 5 and 7F).; LMB alone was able to retain the construct in the nucleus (Figure 11A, bottom).; LMB was sufficient to impede CCTα nuclear export induced by oleate or farnesol or by CRM1 overexpression supports our hypothesis that CCTα nuclear export is CRM1 dependent, perhaps also mediated by the 290–299 signature.",CTP:phosphocholine cytidylyltransferase alpha (CCTα),"We identified a new calmodulin kinase I (CaMKI) substrate, cytidyltransferase (CCTα), a crucial enzyme required for maintenance of cell membranes.; Mammalian cells critically rely on the regulatory and rate-limiting enzyme CTP:phosphocholine cytidylyltransferase (CCT) for generation of cell membranes and other vital components, including pulmonary surfactant, lipoproteins, and bile (Jackowski and Fagone, 2005). CCTα, the major isoform identified in lung cells catalyzes a reaction generating phosphatidylcholine (PtdCho), the major phospholipid of animal membranes.",Residues 290–299,"CaMKI docks within the CCTα membrane-binding domain (residues 290–299), a sequence that displays similarities to a canonical nuclear export signal (NES) that also binds CRM1/exportin 1.; Specifically, a point mutation of Leu-290 to Ala (CCT290) and a CCT289 truncated mutant displayed loss of ability to interact with CaMKI (Figure 4G, bottom). This was supported by the observation that an internal deletion mutant, CCTΔ290/299, and CCT290A lacked ability to bind CaMKI and failed to robustly translocate to the nucleus even with exogenous Ca2+ (Figures 4, G and I, and 5C and Supplemental Figure S3).; Thus the results show that the CCTα sequence spanning residues 290–299 is required for CaMKI docking and displays similarity to a universal NES.; The CCT 290–299 fragment is sufficient to confer nuclear export; Thus the isolated 290–299 fragment binds CRM1 and exhibits LMB sensitivity, and farnesol relocates this fragment to the cytoplasm, which all support that this sequence is a NES within CCTα.",yes,Based on source directories: {'../src/full_text'},Internal deletion of residues 290–299 (CCTΔ290/299),"The mapping studies using GST pull-downs (Figure 7D) or pull-down studies using CRM1-conjugated beads (Figure 7E) with various CCTα mutants revealed an identical binding motif (CCT290 to CCT299) used by CRM1 to access CCT similar to CaMKI.; Figure 7E: CCTα full length and an internal deletion mutant were synthesized using TnT (top), followed by pull-down assays using CRM1-conjugated beads (bottom).",Deletion of residues 290–299 (CCTα Δ290/299),Expression of a CFP-CCTα mutant lacking residues 290–299 in cells results in cytosolically retained enzyme.; expression of a CFP-CCTα mutant lacking this putative NES signature in cells resulted in cytosolically retained enzyme,Murine lung epithelial (MLE) cells,We performed loss-of-function studies in murine lung epithelial (MLE) cells to assess a requirement for CaMKI for CCTα nuclear entry.; MLE cells were maintained in Hite's medium supplemented with 2% fetal bovine serum at 37°C in 5% CO2.,,,,,LEMFGPEGAL,,True,"Prior work suggests that CCTα nuclear export is LMB insensitive but dependent on its membrane-binding domain (Gehrig et al., 2009). This study did not identify and characterize a NES, perhaps because computational results (NetNES) do not predict a NES in the CCTα primary sequence; furthermore, only ∼36% of CRM1-binding sequences fit the wildly accepted canonical NES consensus sequence, L-X(2-3)-[LIVFM]-X(2,3)-L-X-[LI] (la Cour et al., 2003). The disparities between our results and those of others may be related to culture conditions (e.g., Ca2+ concentrations, differing cell lines), as recently shown (Mills and Truong, 2010)."
CHIKV C,,,"Leptomycin B sensitivity, localization assays (EGFP fluorescence, immunofluorescence), site-directed mutagenesis","The chromosomal maintenance 1 (CRM1) export adaptor protein mediated CHIKV capsid protein export from the nucleus; Furthermore, both WT CHIKV capsid and WT VEEV capsid accumulated in the nucleus in cells treated with the nuclear export inhibitor leptomycin B (Figure 1B).; Leptomycin B disrupts nuclear export mediator protein CRM1 binding to capsid protein, suggesting that both VEEV and CHIKV capsid protein are actively exported from the nucleus.; To investigate whether this motif was responsible for CHIKV capsid protein nuclear export, site-directed mutagenesis was performed altering the wild type (WT) residues L51 and M53 to alanines.; WT CHIKV EGFP-capsid fusion protein was distributed between the cytoplasm and nucleus (Figure 1B). Mutation of the putative NES (∆NES) resulted in the EGFP-∆NES capsid fusion protein signal being solely nuclear (Figure 1B).; protein localization determined by indirect immunofluorescence using anti-CHIKV capsid and nsP2 antibodies.; In accordance with previous studies, export of CHIKV capsid protein was CRM1 dependent, with capsid unable to exit the nucleus upon leptomycin B treatment.",CHIKV capsid protein,"Capsid protein, a structural protein encoded by the CHIKV RNA genome, is able to translocate to the host cell nucleus.; Using replicon systems, we investigated a nuclear export sequence (NES) in the N-terminal region of capsid protein; analogous to that found in encephalitic alphavirus capsid but uncharacterised in CHIKV.; The chromosomal maintenance 1 (CRM1) export adaptor protein mediated CHIKV capsid protein export from the nucleus",L51 and M53,"Amino acid sequence alignment of CHIKV capsid with that of the encephalitic alphavirus VEEV (Venezuelan equine encephalitis virus) [7] identified a putative nuclear export sequence (NES) in the N-terminal part of the protein (Figure 1A).; To investigate whether this motif was responsible for CHIKV capsid protein nuclear export, site-directed mutagenesis was performed altering the wild type (WT) residues L51 and M53 to alanines.; Our results outline a minimal NES, with homology to the NES of VEEV capsid protein, consisting of hydrophobic amino acid residues in the N terminal of the capsid protein.",yes,Based on source directories: {'../src/full_text'},"Site-directed mutagenesis altering the wild type (WT) residues L51 and M53 to alanines (∆NES) resulted in the EGFP-∆NES capsid fusion protein signal being solely nuclear. This outcome is similar to the accumulation in the nucleus observed in cells treated with the nuclear export inhibitor leptomycin B, which disrupts nuclear export mediator protein CRM1 binding to capsid protein.",,L51A and M53A (referred to as ∆NES),mutating the NES of capsid protein (∆NES) blocked host protein access to the nucleus.; The mutations L51A and M53A within the CHIKV capsid protein encoding region were generated using overlapping PCR products.; Mutation of the putative NES (∆NES) resulted in the EGFP-∆NES capsid fusion protein signal being solely nuclear (Figure 1B).,chikungunya virus (CHIKV),Transmitted by mosquitoes; chikungunya virus (CHIKV) is responsible for frequent outbreaks of arthritic disease in humans.; The chromosomal maintenance 1 (CRM1) export adaptor protein mediated CHIKV capsid protein export from the nucleus and a region within the N-terminal part of CHIKV capsid protein was required for active nuclear targeting.,"This NES differs from the one previously reported in CHIKV capsid protein, which describes a non-classical sequence towards the centre of the protein [8]. It is therefore possible that CHIKV capsid contains two NESs that must both be intact for functional export of capsid from the nucleus, stressing the importance of capsid protein nuclear shuttling in CHIKV replication.",,,,,,"Yes, the identified NES differs from a previously reported one, suggesting possible multiple NESs or an incomplete prior annotation.",
