Pericentrin,,,"Leptomycin B (LMB) sensitivity (pericentrin accumulates in the nucleus upon LMB treatment); co-immunoprecipitation of pericentrin with Crm1 in vivo; GST pull-down assay showing direct binding of HA-pericentrin to GST-Crm1 in vitro; localization assays of GFP-tagged pericentrin fragments showing cytoplasmic distribution and nuclear relocation upon LMB treatment; Rev1.4-GFP nuclear export assay showing restored export activity by inserting NESs, and retention in the nucleus upon LMB treatment; mutational analysis of NESs abolishing export activity.","Although pericentrin was shown to localize in the cytoplasm and reported to be sensitive to leptomycin B (LMB), a specific inhibitor of Crm1...; All of the five NESs could bind to Crm1 in a LMB-sensitive way when mediating the nuclear export of pericentrin.; A recent study has found that pericentrin could accumulate into the nucleus after the treatment of leptomycin B (LMB), a specific inhibitor of Crm1-mediated nuclear export; The immunofluorescence microscopy results showed that pericentrin predominantly localized in the cytoplasm with a strong focus on centrosomes in HeLa cells, and that the nuclear pericentrin was increased greatly after treatment with LMB, supporting the notion that pericentrin is exported from the nucleus to the cytoplasm in a Crm1-mediated pathway (Figure 1A).; The results showed that Crm1, importin β and Ran GTPase were all co-immunoprecipitated with pericentrin (Figure 1B), indicating that pericentrin was able to bind Crm1 and importin β in vivo under the regulation of Ran GTPase.; we performed the GST pull-down assays using both GST-Crm1 and GST-importin β proteins in the lysates of the HA-pericentrin-expressing HeLa cells, and found that both GST-Crm1 and GST-importin β could specifically pull-down HA-pericentrin in the cell lysates (Figure 1C).; Our results showed that the fragments PCNT1-268 (containing cNES1), PCNT1146-1302 (containing cNES4 and cNES5), PCNT1420-1558 (containing cNES6) and PCNT1596-1764 (containing cNES7) exhibited specifically cytoplasmic distribution, and relocated into the nucleus when cells were treated with LMB (Figure 2B); As expected, we found that only PCNT1-268, PCNT1146-1302, PCNT1420-1558 and PCNT1596-1764 could be pulled down by GST-Crm1 (Figure 2D), suggesting that these fragments were exported from the nucleus to the cytoplasm through interacting with Crm1.; The nuclear export assay using NES-deficient vector Rev1.4-GFP was reported previously and has been recognized to be an effective method to test the nuclear export activity of functional NESs; when the cells were treated with LMB, all the fusion proteins of Rev1.4-GFP with cNESs were retained in the nucleus, indicating that all of them were sensitive to LMB treatment (Figure 3B).; As expected, these cNES-mutant proteins localized in the nucleus even when the cells were treated with Act.D (Figure 3C), indicating that their NES functions were abolished by the mutation.",Pericentrin,"Pericentrin, a conserved centrosomal component, provides the structural scaffold...; Pericentrin is a conserved component of the pericentriolar matrix...","[{'name': 'NES1 (formerly cNES1)', 'sequence': 'LELEALRLSL', 'positions': '245-254', 'export_activity_score': '3+ (weak)'}, {'name': 'NES2 (formerly cNES4)', 'sequence': 'LQDALRRLLGL', 'positions': '1158-1168', 'export_activity_score': '2+ (weak)'}, {'name': 'NES3 (formerly cNES5)', 'sequence': 'FGETLRAAVTL', 'positions': '1169-1179', 'export_activity_score': '2+/1+ (weak/very weak)'}, {'name': 'NES4 (formerly cNES6)', 'sequence': 'LDEFNELAI', 'positions': '1540-1548', 'export_activity_score': '1+ (very weak)'}, {'name': 'NES5 (formerly cNES7)', 'sequence': 'VIEKLQHELSL', 'positions': '1745-1755', 'export_activity_score': '7+ (strong)'}]","By comparing with the scoring system standard, we determined that cNES7 (residues 1 745 to 1 755) is a relatively strong NES (scoring 7+), whereas cNES1 (residues 245 to 254), cNES4 (residues 1 158 to 1 168), cNES5 (residues 1 169 to 1 179) and cNES6 (residues 1 540 to 1 548) are weak (scoring 3+, 2+, 2+/1+ and 1+, respectively) but functional NESs.; In summary, we identified for the first time five functional NESs and one tripartite NLS within pericentrin that are important for its subcellular localization and its nucleocytoplasmic trafficking during the cell cycle (Table 2).; Table 2 The functional NLS and NESs in pericentrin (NES1: 245LELEALRLSL254; NES2: 1158LQDALRRLLGL1168; NES3: 1169FGETLRAAVTL1179; NES4: 1540LDEFNELAI1548; NES5: 1745VIEKLQHELSL1755); The cNESs sequences of pericentrin (cNES1, 245LELEALRLSL254; cNES4, 1158LQDALRRLLGL1168; cNES5, 1169FGETLRAAVTL1179; cNES6, 1540LDEFNELAI1548; and cNES7, 1745VIEKLQHELSL1755)",yes,Based on source directories: {'../src/full_text'},,,"Point mutations of the last two hydrophobic residues to alanines in individual NESs: NES1 (L252A, L254A), NES2 (L1166A, L1168A), NES3 (V1177A, L1179A), NES4 (L1546A, I1548A), NES5 (L1753A, L1755A). Additionally, mutation of all five NESs in full-length pericentrin.","As the last two hydrophobic residues in NES sequences are generally the most conserved and most important ones for the nuclear export activity, these two residues of Rev1.4-GFP fusion proteins with cNESs were replaced by alanines...; As expected, these cNES-mutant proteins localized in the nucleus even when the cells were treated with Act.D (Figure 3C), indicating that their NES functions were abolished by the mutation.; The sequences of the tested cNESs and their point mutations that were inserted into pRev (1.4)-GFP. The hydrophobic amino acids were shown in bold and the mutated sites were shown in red. (cNES1-mt, 245LELEALR A S A 254; cNES4-mt, 1158LQDALRRL A G A 1168; cNES5-mt, 1169FGETLRAA A T A 1179; cNES6-mt, 1540LDEFNE A A A 1548; and cNES7-mt, 1745VIEKLQHE A S A 1755); However, when the entire NESs were mutated, the amount of the mutant was increased in the nucleus (Figure 8).; The NLS-deficient mutant and NESs-deficient mutant of full-length pericentrin were generated by site-directed mutagenesis.",Human,we analyzed the amino acid sequence of human pericentrin...; HeLa cells were treated with 10 nM LMB for 6 h...,,,,,,,,
Protein UL84,UL84,The open reading frame UL84 of human cytomegalovirus (HCMV) encodes an essential regulatory protein...; FIG. 1. pUL69 contains two active leucine-rich NESs. (A) Schematic representation of the UL84 protein showing the NLS/importin alpha binding domain (20).,"Leptomycin B (LMB) sensitivity in interspecies heterokaryon assays, microinjection experiments with GST-NES fusion proteins, and heterokaryon analysis in HCMV-infected and transfected cells.","To investigate the contribution of the CRM1 pathway to the nuclear export of pUL84, HeLa cells were cotransfected with a pUL84 expression plasmid and a control plasmid encoding the CRM1-independent nucleocytoplasmic shuttling protein pUL69 (19). Subsequently, heterokaryon assays were performed as described above, with the exception that 3 h prior to and following heterokaryon formation, the cells were treated with 2.5 ng/ml LMB to inhibit CRM1 function.; As shown in Fig. 1E, a to d, the coinjected rabbit IgG was detected exclusively within the nucleus, whereas GST-UL84-NES1 or GST-UL84-NES2 was translocated from the nuclear injection site to the cytoplasm in significant amounts.; As shown in Fig. 2A, b, by 3.5 h postfusion, pUL84 had migrated into the murine nuclei.",pUL84,Previous studies defined pUL84 of human cytomegalovirus as an essential regulatory protein with nuclear localization...; The open reading frame UL84 of human cytomegalovirus (HCMV) encodes an essential regulatory protein that appears to be localized within the cell nucleus,Two signals: amino acids 228 to 237 (UL84-NES1) and amino acids 359 to 366 (UL84-NES2) of pUL84.,"For this, we fused amino acids 228 to 237 and 359 to 366 of pUL84 to the C terminus of glutathione S-transferase (GST) (Fig. 1C), which served as a carrier protein.; pUL84 encodes two NESs that are equally capable of mediating the nuclear export of a heterologous protein (Fig. 1).",yes,Based on source directories: {'../src/full_text'},,,"Alanine substitutions for leucine residues within the core motif of the NES. Specifically, LLL228/30/59AAA (mutations in both NES1 and NES2), LL228/30AA (mutations in NES1), and L359A (mutation in NES2) abolished or impaired nuclear export.","It has been demonstrated that substitution of alanine for any leucine within the core motif of the NES abrogates export activity (12, 29).; In light of these results, we generated plasmid LLL228/30/59AAA, encoding pUL84 with mutations at key residues in both UL84-NES1 and UL84-NES2 that were predicted to inhibit nuclear export but not nuclear import (Fig. 3A, o and p).; When we subjected this mutant to the interspecies heterokaryon assay, we observed that the nuclear-export capability of the pUL84 mutant was completely abolished, excluding the existence of other, unrecognized NESs (Fig. 4, i to l).; However, when heterokaryon assays were performed with mutants LL228/30AA and L359A, which inactivated only one of the two NESs, weak pUL84 staining was detected in murine nuclei (Fig. 4, a to d and e to h).",human cytomegalovirus (HCMV),Previous studies defined pUL84 of human cytomegalovirus as an essential regulatory protein with nuclear localization...; The open reading frame UL84 of human cytomegalovirus (HCMV) encodes an essential regulatory protein...,,,,,,,,
RanBP1,hRanBP1,"We identified a related NES region in the Ran GTPase-binding protein 1 of human (hRanBP1); The NESs of human and mouse RanBP1 and the rabbit and mouse PKI proteins are compared, and the derived consensus is given.",,,human Ran GTPase-binding protein RanBP1,We identified a region in the human Ran GTPase-binding protein RanBP1 that shares similarities to the nuclear export signal of the inhibitor of the cAMP-dependent protein kinase.,amino acids 72-88 of Rev,,yes,Based on source directories: {'../src/full_text'},,,"L183A, L186A, and V188A","We generated a RanBP1 fusion with GFP and also introduced mutations within the NES region (L183A, L186A, and V188A; see Fig. 1), generating NES(−)RanBP1.; Thus, the NES(−) mutation inactivates the nuclear export signal.",human,We identified a region in the human Ran GTPase-binding protein RanBP1; We identified a related NES region in the Ran GTPase-binding protein 1 of human (hRanBP1),,,,,,,,
RanGAP1,"Rna1p (for yeast RanGAP, a homolog of mammalian RanGAP1)",,"RNAi-knockdown of CRM1, inactivation of CRM1 by leptomycin B (LMB), immunofluorescence microscopy to observe nuclear accumulation and redistribution of RanGAP1.",Here we show that inhibition of CRM1-mediated nuclear export using RNAi-knockdown of CRM1 and inactivation of CRM1 by leptomycin B (LMB) results in nuclear accumulation of RanGAP1.; LMB treatment induced a more robust redistribution of RanGAP1 from the cytoplasm to the nucleoplasm compared to CRM1 RNAi and also uniquely triggered a decrease or loss of RanGAP1 localization at the NPC...; Immunofluorescence microcopy and image analysis,Ran GTPase activating protein RanGAP1,"The Ran GTPase activating protein RanGAP1 plays an essential role in nuclear transport by stimulating RanGTP hydrolysis in the cytoplasmic compartment.; Mammalian RanGAP1 contains a non-classical NLS at its C-terminal SUMO-AD domain and nine putative leucine-rich NESs, which can be recognized by CRM1 (also known as Exportin 1 or Xpo1), at its N-terminal LRR domain [12].",,,yes,Based on source directories: {'../src/full_text'},,,,,"Mammalian cells (HeLa cells, Buffalo rat liver cells)","The Cellular Distribution of RanGAP1 Is Regulated by CRM1-Mediated Nuclear Export in Mammalian Cells.; In mammalian cells, unmodified RanGAP1 is predominantly cytoplasmic...; Human cervical cancer cells (HeLa) [31] and Buffalo rat liver cells (BRL) [14] were cultured in Dulbecco's Modified Eagle's Medium (DMEM)...",,,,,,,"The text states that RanGAP1 contains ""nine putative leucine-rich NESs"" and ""nine putative nuclear export signals,"" indicating that these signals are generally considered to exist but are not definitively established, thus implying a degree of doubt regarding their absolute validity.",
RapGEF1,"C3G, RapGEF1",C3G (RapGEF1) is a ubiquitously expressed guanine nucleotide exchange factor; The ubiquitously expressed guanine nucleotide exchange factor C3G (Rap guanine nucleotide exchange factor 1 [RapGEF1]),"Leptomycin B (LMB) sensitivity, localization assays, mutagenesis","Coexpression of importin-α and inhibition of nuclear export by leptomycin B resulted in predominant nuclear localization of C3G.; To determine whether C3G shows dynamic nucleocytoplasmic exchange, we examined Cos-1 cells expressing C3G for its localization in the presence or absence of leptomycin B (LMB), an inhibitor of chromosome region maintenance 1 (CRM1; Kudo et al., 1999), a protein that functions primarily to export a large number of proteins from the nucleus and depends on leucine-rich nuclear export signals.; Quantitation of fluorescence in the nucleus relative to that in the whole cell (N/W) showed that LMB treatment results in an increase in level of C3G in the nucleus; The ability of amino acids 776–791 to function as NES was examined directly by introducing these residues into a Rev–green fluorescent protein (GFP) expression vector (Henderson and Eleftheriou, 2000) and monitoring nuclear exit in response to LMB (Figure 2A). Rev-GFP shows exclusive nuclear localization, which is not sensitive to LMB. Introduction of C3G-NES sequences enables the protein to move into the cytoplasm (Figure 2, B and C).; The ability of these sequences to function as NES in the context of C3G was confirmed by site-directed mutagenesis of two leucines, LL779/781AA, in C3G-GFP (Figure 2D). Mutant NES (mNES)–expressing cells showed higher levels of nuclear protein than did wild type (WT; Figure 2, E and F). Whereas the WT responded to LMB treatment, the NES mutant did not, indicating that the two mutated leucine residues were indeed responsible for CRM1-mediated nuclear export.",Rap guanine nucleotide exchange factor 1,The ubiquitously expressed guanine nucleotide exchange factor C3G (Rap guanine nucleotide exchange factor 1 [RapGEF1]) functions in signaling pathways to transmit information received by a variety of receptors and regulate cellular functions,Amino acids 776–791,"To test whether residues in the C-terminal showing consensus with typical NES (amino acids 776–791) are functional, we used deletion constructs of C3G that lack the catalytic (ΔC) or N-terminal (ΔN) domain or have only the CBR domain; The ability of amino acids 776–791 to function as NES was examined directly by introducing these residues into a Rev–green fluorescent protein (GFP) expression vector; Rev(C3G-NES)-GFP construct was generated by cloning C3G-NES (amino acids 776–791) into Rev-NES-GFP at BamHI and AgeI sites after excising out the default NES.",yes,Based on source directories: {'../src/full_text'},"Site-directed mutagenesis of two leucines, LL779/781AA, in C3G-GFP, resulted in a mutant NES (mNES) that did not respond to leptomycin B (LMB) treatment, indicating that these mutated leucine residues were responsible for CRM1-mediated nuclear export.",,LL779/781AA (leucine to alanine at positions 779 and 781),"The ability of these sequences to function as NES in the context of C3G was confirmed by site-directed mutagenesis of two leucines, LL779/781AA, in C3G-GFP (Figure 2D).; Mutant NES (mNES)–expressing cells showed higher levels of nuclear protein than did wild type (WT; Figure 2, E and F).; Whereas the WT responded to LMB treatment, the NES mutant did not, indicating that the two mutated leucine residues were indeed responsible for CRM1-mediated nuclear export.","Human, Mouse","Examination of the localization of C3G by subcellular fractionation and Western blotting in a variety of human cell lines showed that C3G is present in the nucleus as well as cytoplasm; Nuclear localization of C3G was not restricted to human cells, as myoblast cells from mouse also showed significant levels of C3G in the nucleus; To determine whether C3G shows dynamic nucleocytoplasmic exchange, we examined Cos-1 cells expressing C3G for its localization in the presence or absence of leptomycin B (LMB); The ability of these sequences to function as NES in the context of C3G was confirmed by site-directed mutagenesis of two leucines, LL779/781AA, in C3G-GFP (Figure 2D). Mutant NES (mNES)–expressing cells showed higher levels of nuclear protein than did wild type (WT; Figure 2, E and F). Whereas the WT responded to LMB treatment, the NES mutant did not, indicating that the two mutated leucine residues were indeed responsible for CRM1-mediated nuclear export.","['GSK3-β–dependent phosphorylation regulates the dynamic nuclear localization and nucleocytoplasmic exchange of C3G, with phosphorylation retaining C3G in the cytoplasm and dephosphorylation causing its translocation into the nucleus.', 'The catalytic domain of C3G may partly mask the nuclear export signal (NES) in the cellular context, as a deletion mutant lacking this domain showed increased responsiveness to leptomycin B (LMB) treatment, an inhibitor of nuclear export.']",,,,,,,
Rei1,"[{'name': 'B23', 'excerpt': 'For nucleophosmin (also called B23 or NO38), we measured a nuclear concentration of ≈ 2.3 µM, a cytoplasmic concentration of 8 nM, and hence a nucleocytoplasmic (N:C) partition coefficient of 300:1.'}, {'name': 'NO38', 'excerpt': 'For nucleophosmin (also called B23 or NO38), we measured a nuclear concentration of ≈ 2.3 µM, a cytoplasmic concentration of 8 nM, and hence a nucleocytoplasmic (N:C) partition coefficient of 300:1.'}]",,"Leptomycin B (LMB) sensitivity in localization assays (e.g., GFP-fusion localization in HeLa cells), and RanGTP-dependent binding to purified CRM1 in affinity chromatography/binding assays.","A CRM1-block by 10 nM leptomycin B, however, caused the fusion to equilibrate between nucleus and cytoplasm, suggesting a significant nuclear entry rate and rapid CRM1-dependent retrieval in undisturbed cells.; We identified this NES within the N-terminal unstructured region of eRF3a and confirmed its nuclear export activity by transfection assays as well (Figure 4).; eRF3a binds also purified CRM1 in a RanGTP-dependent manner (Figure 5), suggesting that the interaction is direct and not bridged by another factor.",,,,,yes,Based on source directories: {'../src/full_text'},,,,,"Saccharomyces cerevisiae (yeast), Xenopus laevis (frog) oocytes, and human (HeLa) cells.","We now explored the cargo-spectrum of CRM1 in depth and identified surprisingly large numbers, namely >700 export substrates from the yeast S. cerevisiae, ≈1000 from Xenopus oocytes and >1050 from human cells.; We report here global scale analyses of nucleocytoplasmic partitioning in Xenopus oocytes and of CRM1-mediated nuclear export. According to stringent criteria, we identified ≈ 1000 potential CRM1 cargoes from Xenopus laevis oocytes, ≈ 1050, from human HeLa cells, and ≈ 700 from the yeast S. cerevisiae.; In total, we tested 29 candidates from Xenopus, human and yeast, and validated 23 of them positive (Figures 4, 6, 7 and 8), suggesting that the majority of hits represent indeed CRM1 cargoes.","Phosphorylation of adjacent serine residues can inactivate the NES (e.g., Cyclin B), or phosphorylation can be required for efficient interaction with CRM1 (e.g., PHAX).","Cyclin B, for example, is kept cytoplasmic by CRM1 until prophase, when the NES gets inactivated by phosphorylation of adjacent serine residues and the protein suddenly accumulates inside nuclei (Yang et al., 1998).; PHAX, the export adapter for U snRNAs, on the other hand, requires phosphorylation for an efficient interaction with CRM1 (Kitao et al., 2008).","For eRF3a, the NES is in an N-terminal unstructured region. For Arp2/3-1b, the NES is described as packing against the rest of the chain with loose packing and high local B-factor, suggesting it is sufficiently mobile/flexible to be exposed for CRM1-binding.","We identified this NES within the N-terminal unstructured region of eRF3a; The rather loose packing and high local B-factor suggest, however, that this NES region is sufficiently mobile to get transiently exposed for subsequent CRM1-binding.",,,"The study identified 11 proteins listed as CRM1-cargoes in the NESdb that were classified as CRM1 non-binders in this study. Seven of these conflicting cases were re-tested and behaved as CRM1 non-binders, suggesting they are false-positives in the NESdb.","The just mentioned non-binders include several cases (11) that have been listed as CRM1-cargoes in the NESdb (Supplementary file 5; Xu et al., 2012b). This could now point to the false-positives in the NESdb or to contaminating false-negatives in our dataset.; To address this issue, we analysed seven of these conflicting cases and tested the behaviour of the corresponding GFP fusions in the HeLa cell transfection assay (Figure 7—figure supplement 1). All of them showed a considerable nuclear signal already in untreated cells and this nuclear signal did not further increase upon blocking CRM1 by leptomycin B. These seven re-tested candidates thus behaved as predicted from their classification as CRM1 non-binders, at least for the tested protein isoforms (cloned from HeLa cell cDNA), for the tested cell type (human HeLa cells) and under standard cell culture conditions."
RoXan,"ZC3H7B, FLJ13787, KIAA1031","RoXaN (ZC3H7B, FLJ13787, KIAA1031) contains several different protein-protein interaction domains",Leptomycin B sensitivity and localization assays with mutagenesis.,"Moreover, treating cells transfected with the NLS-LD-beta-galactosidase construct with LMB led to nuclear accumulation of the chimeric protein (Fig. 9G to I), demonstrating that nuclear export of NLS-LD-beta-galactosidase requires a functional CRM1-export pathway.; It is clear that the presence of an intact, wt LD domain with the NLS-beta-galactosidase protein leads to the accumulation of the chimeric protein in the cytoplasm (Fig. 9A to C) but that the mutated chimera is present primarily in the nucleus (Fig. 9D to F)",RoXaN,"Another cellular protein, a binding partner of NSP3, has been identified and called RoXaN",RoXaN LD domain (amino acids 264 to 271) with sequence L Dt L Lds L s L.,RoXaN LD domain (aa 264 to 271) could function as a NES.; Table 1. LD and NES sequences... LD RoXaN L Dt L Lds L s L,yes,Based on source directories: {'../src/full_text'},Amino acids at positions 267 to 269 of the LD domain mutated to alanines.,"Moreover, treating cells transfected with the NLS-LD-beta-galactosidase construct with LMB led to nuclear accumulation of the chimeric protein (Fig. 9G to I), demonstrating that nuclear export of NLS-LD-beta-galactosidase requires a functional CRM1-export pathway.; An additional control was provided by the fusion of the same region of RoXaN but amplified from a mutant (49) in which the amino acids at positions 267 to 269 of the LD domain have been mutated to alanines (Table 1).",Amino acids at positions 267 to 269 of the LD domain mutated to alanines (sequence 'aaa' in Table 1).,An additional control was provided by the fusion of the same region of RoXaN but amplified from a mutant (49) in which the amino acids at positions 267 to 269 of the LD domain have been mutated to alanines (Table 1).; the mutated chimera is present primarily in the nucleus (Fig. 9D to F),Human,"RoXaN (ZC3H7B, FLJ13787, KIAA1031); HEK293 cells (approximately 2 × 10^6 per 60-mm poly-l-lysine-coated plate [BDBiocoat, Erembodegem, Belgium])","Amino acids at positions 267 to 269 of the RoXaN LD domain, specifically changing 'Lds' to 'aaa', impair the nuclear export signal function, leading to nuclear accumulation of the chimeric protein. This region includes non-hydrophobic residues D268 and S269, which are critical for export.",,,,,,,
