L-Periaxin,L-PRX,Myelinating Schwann cells specifically express L-periaxin (L-PRX) in the mammalian peripheral nervous system.,"Leptomycin B sensitivity; Localization assays (fluorescence microscopy, Western blotting of cytoplasmic/nuclear fractions); Mutagenesis (deletion of PDZ domain, point mutations L83Q, L85Q); Chimeric protein assays (PDZ-cyclin A1 fusion).","Treatment with leptomycin B (LMB), a specific inhibitor of nuclear export mediated by leucine-rich nuclear export signal (NES), also causes nuclear accumulation of wild-type L-periaxin.; Double leucine mutation (L83, 85Q) in the putative NES in the PDZ domain prevented L-periaxin nuclear export and induced nuclear accumulation.; L-periaxin was localized in the cytoplasm of RSC96 cells. By contrast, a mutant L-periaxin with a deleted PDZ domain was localized mainly in the nucleus of RSC96 cells.; After a nuclear cyclin A1, which is localized exclusively in the nucleus, was fused with the PDZ domain, cyclinA1was found in the cytoplasm of RSC96 cells.; EGFP fusion proteins in the cells were visualized using Delta Vision (API, United States).; The cytoplasm and nucleus were separated and determined the distribution of EGFP-L-periaxin and EGFP-PDZ-cyclin A1 in the two fractions by Western blotting.",L-periaxin,"Myelinating Schwann cells specifically express L-periaxin (L-PRX) in the mammalian peripheral nervous system.; L-periaxin, which contains a PDZ domain, a nuclear localization signal (NLS) domain, a repeat domain, and an acidic domain, was localized in the cytoplasm of RSC96 cells.",73-86,"An NES was identified in the amino acid sequence of L-periaxin PDZ domain between residues 73 and 86 by using the NetNES program.; the amino acid sequence (VFFENFKYEDA L R L L) between residues 73 and 86 in the L-periaxin PDZ domain is significantly similar to the NES sequences reported for MAPKK, zyxin, HIV.Rev, c-Abl, and LIM-kinase 1, sharing underlined hydrophobic (leucine) properties",yes,Based on source directories: {'../src/full_text'},,,"L83Q, L85Q (double leucine mutation)","Double leucine mutation (L83, 85Q) in the putative NES in the PDZ domain prevented L-periaxin nuclear export and induced nuclear accumulation.; L-periaxin (L83,85/Q) and PDZ-cyclin A1 (L83,85/Q) were localized mainly in the nucleus",Rat (RSC96 Schwann cells),"L-periaxin was localized in the cytoplasm of RSC96 cells.; Rat RSC96 Schwann cells (Type Culture Collection of the Chinese Academy of Sciences, Shanghai, China) were maintained in Dulbecco's modified Eagle's medium supplemented with 10% fetal bovine serum at 37°C in a humidified atmosphere containing 5% CO2.",,,,,,,,
Liar,Ankrd54,Liar has also been identified as a highly expressed transcript in ciliated cells and was designated Ankrd54.,"Leptomycin B sensitivity, localization assays, mutagenesis, and subcellular fractionation studies.","Cells were then treated with Leptomycin B (Figure 2E), a specific inhibitor of Crm1-dependent nuclear export, which induced considerable Liar relocation to the nucleus (N:C ratio 275:1).; Localization analysis of Liar the NES mutant. Wild-type Liar (Liar WT) and the NES point mutant (Liar LSL289ASA) were expressed and analyzed as described in panel B top.; To determine whether the putative NES was functional, the leucines at positions 289 and 291 were mutated to alanine (Figure 2D); this resulted in substantial build up of Liar within the nucleus (N:C ratio 45:1).; Cellular fractionation studies confirmed that deletion of the NLS (Δ98-114) resulted in preferential cytoplasmic localization, while mutation of the NES (LSL 289 to ASA) significantly enhanced nuclear accumulation (Figure 2G).",Liar (Lyn-interacting ankyrin repeat),"Liar (Lyn-interacting ankyrin repeat), which forms a multiprotein complex with Lyn and HS1 in erythroid cells.","[{'value': '289-291', 'excerpt': 'nuclear export signal (NES; LiarLSL289ASA) mutants. ... the leucines at positions 289 and 291 were mutated to alanine'}]",,yes,Based on source directories: {'../src/full_text'},"nuclear export signal (NES; LiarLSL289ASA) mutants. ... To determine whether the putative NES was functional, the leucines at positions 289 and 291 were mutated to alanine (Figure 2D); this resulted in substantial build up of Liar within the nucleus (N:C ratio 45:1). Cells were then treated with Leptomycin B (Figure 2E), a specific inhibitor of Crm1-dependent nuclear export, which induced considerable Liar relocation to the nucleus (N:C ratio 275:1).",,LiarLSL289ASA (mutation of leucines at positions 289 and 291 to alanine),the leucines at positions 289 and 291 were mutated to alanine (Figure 2D); this resulted in substantial build up of Liar within the nucleus (N:C ratio 45:1).; mutation of the NES (LSL 289 to ASA) significantly enhanced nuclear accumulation (Figure 2G).,Murine (protein source); African green monkey (COS-7 cells for characterization); Murine (J2E erythroid cells for characterization),"The Liar fragment from the yeast 2-hybrid screen was used to isolate a full-length murine cDNA encoding a 299-aa protein with a predicted molecular mass of 32.5 kDa (Figure 1A).; While confocal microscopy revealed that Liar was present in the nucleus and cytoplasm of transiently transfected COS-7 cells (Figure 2B); Somewhat surprisingly, endogenous Liar localized primarily in the cytoplasm of J2E cells (Figure 5C).",,,,,,,,
Lsg1,"[{'name': 'B23', 'excerpt': 'For nucleophosmin (also called B23 or NO38), we measured a nuclear concentration of ≈ 2.3 µM, a cytoplasmic concentration of 8 nM, and hence a nucleocytoplasmic (N:C) partition coefficient of 300:1.'}, {'name': 'NO38', 'excerpt': 'For nucleophosmin (also called B23 or NO38), we measured a nuclear concentration of ≈ 2.3 µM, a cytoplasmic concentration of 8 nM, and hence a nucleocytoplasmic (N:C) partition coefficient of 300:1.'}]",,"Leptomycin B sensitivity, localization assays (GFP-fusion in HeLa cells, experimentally determined localization in Xenopus oocytes), SV40 NLS fusion assays, direct CRM1 binding assay (RanGTP-dependent).","Its GFP-fusion was exclusively cytoplasmic in transfected HeLa cells (Figure 4); A CRM1-block by 10 nM leptomycin B, however, caused the fusion to equilibrate between nucleus and cytoplasm; We also transfected a fusion that included an SV40 nuclear localisation signal (GFP-NLS-eRF3a); eRF3a binds also purified CRM1 in a RanGTP-dependent manner (Figure 5)",Xenopus translation termination factor eRF3a,The first was the Xenopus translation termination factor eRF3a.,,,yes,Based on source directories: {'../src/full_text'},,,,,Xenopus laevis,The first was the Xenopus translation termination factor eRF3a.; Xenopus laevis oocytes,"Cyclin B's NES is inactivated by phosphorylation of adjacent serine residues, leading to nuclear accumulation.",,Unstructured region (N-terminal),We identified this NES within the N-terminal unstructured region of eRF3a,,,NES prediction will therefore remain unreliable and produce frequent false-positive hits as long as it is based on an unreliable list of positive cases.,
M1,,,"Leptomycin B (LMB) sensitivity, EGFP-fusion protein localization assays, and site-directed mutagenesis.","The mechanism of this intracellular transport of BM1 was revealed through the identification of two leucine-rich CRM1-dependent nuclear export signals (NESs); The biological function of the NLS and NES regions were determined through the observation of the intracellular distribution of enhanced green fluorescent protein (EGFP)-tagged signal peptides, and wild-type, NES-mutant, and NLS-mutant EGFP-BM1.; EGFP-NES1 (3 to 14 aa) was predominantly distributed in the cytoplasm of the transfected cells at the 20 h posttransfection and then evenly distributed between the cytoplasm and nucleus after LMB treatment for 2 h, suggesting that NES1 was a functional CRM1-dependent NES.; The predominant cytoplasmic distribution of EGFP-115-133 was also inhibited by LMB treatment, suggesting the NES2 also acts as a functional CRM1-dependent NES.; To investigate the role of NES1 and NES2 in the nuclear export of BM1, several critical hydrophobic amino acids of NES1 and NES2 in the EGFP-BM1 proteins were substituted by alanine (Fig. 4A).; The distribution of NES1-mutant EGFP-BM1 (L12/14A) showed no difference from the predominantly cytoplasmic distribution of WT EGFP-BM1. The NES2-mutant EGFP-BM1 (M131A/L133A) was distributed evenly between the cytoplasm and the nuclei of most of the transfected cells and predominantly in the nucleus of a small portion of the transfected cells. The NES1/2-mutant EGFP-BM1 (M131A/L133/12/14A) was predominantly distributed in the nucleus of most of the transfected cells (Fig. 4B).",Matrix protein of influenza B virus,The matrix protein of influenza B virus (BM1) acts as a cytoplasmic-nuclear shuttling protein during the early and late stages of infection.,NES1: 3 to 14 amino acids (aa); NES2: 124 to 133 amino acids (aa).,The mechanism of this intracellular transport of BM1 was revealed through the identification of two leucine-rich CRM1-dependent nuclear export signals (NESs) (3 to 14 amino acids [aa] and 124 to 133 aa),yes,Based on source directories: {'../src/full_text'},"[{'excerpt': 'To investigate the role of NES1 and NES2 in the nuclear export of BM1, several critical hydrophobic amino acids of NES1 and NES2 in the EGFP-BM1 proteins were substituted by alanine (Fig. 4A). ... The NES2-mutant EGFP-BM1 (M131A/L133A) was distributed evenly between the cytoplasm and the nuclei of most of the transfected cells and predominantly in the nucleus of a small portion of the transfected cells. The NES1/2-mutant EGFP-BM1 (M131A/L133/12/14A) was predominantly distributed in the nucleus of most of the transfected cells (Fig. 4B). Taken together, these results suggest that both the NES1 and NES2 participate in the nuclear export of EGFP-BM1 and that the activity of the NES2 is higher than that of the NES1.'}, {'excerpt': 'EGFP-NES1 (3 to 14 aa) was found to be located predominantly in the cytoplasm of the transfected cells at the 20 h posttransfection and then evenly distributed between the cytoplasm and nucleus after LMB treatment for 2 h, suggesting that NES1 was a functional CRM1-dependent NES. EGFP-NES2 (124 to 133 aa) required the N-terminal flanking sequence (EGFP-115-133) for its nuclear export activity in the context of EGFP fusion protein. The predominant cytoplasmic distribution of EGFP-115-133 was also inhibited by LMB treatment, suggesting the NES2 also acts as a functional CRM1-dependent NES.'}]",,"L12A/L14A (in NES1), M131A/L133A (in NES2), and L12A/L14A/M131A/L133A (in both NES1 and NES2).",The distribution of NES1-mutant EGFP-BM1 (L12/14A) showed no difference from the predominantly cytoplasmic distribution of WT EGFP-BM1.; The NES2-mutant EGFP-BM1 (M131A/L133A) was distributed evenly between the cytoplasm and the nuclei of most of the transfected cells and predominantly in the nucleus of a small portion of the transfected cells.; The NES1/2-mutant EGFP-BM1 (M131A/L133/12/14A) was predominantly distributed in the nucleus of most of the transfected cells (Fig. 4B).,Influenza B virus,The matrix protein of influenza B virus (BM1) acts as a cytoplasmic-nuclear shuttling protein during the early and late stages of infection.,N-terminal flanking sequence (residues 115-123) for NES2 activity.,EGFP-NES2 (124 to 133 aa) required the N-terminal flanking sequence (EGFP-115-133) for its nuclear export activity in the context of EGFP fusion protein.,,,,,,
MIER1-3A,N1,"A third N–terminal isoform arises only during transcription from the P1 promoter, which allows for alternate inclusion of a cassette exon, exon 3A; doing so produces a variant containing additional sequence at its N-terminus (named N1 in GenBank).","Subcellular localization assays (immunocytochemistry, confocal microscopy) showing a dramatic shift from nuclear to cytoplasmic localization upon inclusion of exon 3A in MIER1α; sensitivity to leptomycin B (LMB), an inhibitor of CRM1, which restored nuclear localization of MIER1-3Aα; and mutagenesis of critical leucines within the NES consensus sequence (L14A, L16A), which abrogated cytoplasmic localization and significantly increased nuclear staining.","Inclusion of this exon in MIER1α to produce the MIER1-3Aα isoform altered its subcellular distribution in MCF7 cells from 81% nuclear to 2% nuclear; this change in localization was abrogated by mutation of critical leucines within the NES.; Treatment with leptomycin B (LMB), an inhibitor of the nuclear export receptor CRM1, resulted in a significant increase in the percentage of cells with nuclear MIER1-3Aα, from 4% to 53%, demonstrating that cytoplasmic localization of this isoform was due to CRM1-dependent nuclear export.; Analysis of the exon 3A amino acid sequence for possible motifs revealed the presence of a putative leucine-rich NES (underlined in Fig. 1A) that conforms to the consensus: φ–x(2–3)–φ–x(2–3)–φ–x–φ; To confirm that nuclear export of MIER1-3Aα is due to the identified NES, we mutated the consensus sequence. ... we produced a 14,16 L->A double mutant. ... Mutating the NES consensus resulted in a significant increase in the percentage of cells with exclusively nuclear staining, from 4% to 76%",MIER1-3Aα,Inclusion of this exon in MIER1α to produce the MIER1-3Aα isoform altered its subcellular distribution in MCF7 cells; Our results demonstrate that alternative splicing to include exon 3A specifically affects the localization pattern of the α isoform.,,,yes,Based on source directories: {'../src/full_text'},"A 14,16 L->A double mutant in the NES consensus sequence of MIER1-3Aα was produced. Mutating this NES consensus resulted in a significant increase in the percentage of cells with exclusively nuclear staining (from 4% to 76%), indicating impaired nuclear export, which was previously shown to be CRM1-dependent.",,L14A and L16A double mutation within the NES consensus sequence.,"this change in localization was abrogated by mutation of critical leucines within the NES.; we produced a 14,16 L->A double mutant. ... Mutating the NES consensus resulted in a significant increase in the percentage of cells with exclusively nuclear staining, from 4% to 76%, with a concomitant decrease in the percentage of cells showing whole cell N=C staining (Fig. 3B–C).",Human,"95% identity between human [2], [3] and mouse sequences [4] at the amino acid level.; using MCF7 breast carcinoma cells. This cell line retains many of the characteristics of differentiated epithelial cells",,,,,,,,
Mcm3,"[{'Alternative Names': 'NES3', 'Excerpt': 'We henceforth refer to the 67-amino acid segment downstream of the Mcm3 NLS as the Mcm3 NES or NES3.'}, {'Alternative Names': 'Mcm3 leucine-rich motif', 'Excerpt': 'The mutant Mcm3 expressed in these strains contains alanine substitutions in both the four CDK consensus sites flanking the NLS and the leucine-rich repeat of the NES (Figure 1A).'}, {'Alternative Names': 'exportin 1', 'Excerpt': 'CRM1 is an export receptor for leucine-rich nuclear export signals.'}, {'Alternative Names': 'Mcm proteins', 'Excerpt': 'We and others have shown that Cdc28 promotes the nuclear exclusion of the Mcm2-7 complex (Labib et al., 1999; Nguyen et al., 2000). In G1 phase, when Cdc28 kinase levels are low, the Mcm2-7 complex accumulates in the nucleus independent of its loading onto origins. After Cdc28 kinase becomes active in late G1 phase, the Mcm2-7 complex experiences net nuclear export until it is excluded from the nucleus. Little is understood about how Cdc28 controls localization of the Mcm2-7 complex. For example, it is not known whether Cdc28 promotes Mcm2-7 nuclear export by directly phosphorylating the Mcm complex, by targeting some of the many replication proteins known to interact with the complex, or by modulating the activity of the transport machinery.'}, {'Alternative Names': 'Mcm complex', 'Excerpt': 'We and others have shown that Cdc28 promotes the nuclear exclusion of the Mcm2-7 complex (Labib et al., 1999; Nguyen et al., 2000). In G1 phase, when Cdc28 kinase levels are low, the Mcm2-7 complex accumulates in the nucleus independent of its loading onto origins. After Cdc28 kinase becomes active in late G1 phase, the Mcm2-7 complex experiences net nuclear export until it is excluded from the nucleus. Little is understood about how Cdc28 controls localization of the Mcm2-7 complex. For example, it is not known whether Cdc28 promotes Mcm2-7 nuclear export by directly phosphorylating the Mcm complex, by targeting some of the many replication proteins known to interact with the complex, or by modulating the activity of the transport machinery.'}, {'Alternative Names': 'putative replicative helicase', 'Excerpt': 'Assembly of the pre-RC in G1 phase, when CDK activity is low, makes origins competent for replication initiation later in the cell cycle when CDK activity is induced. The pre-RC is assembled when the origin recognition complex (ORC) binds origins and recruits Cdc6 and Cdt1 to help load the putative replicative helicase, the heterohexameric Mcm2-7 complex.'}, {'Alternative Names': 'Mcm3 portion of this module', 'Excerpt': 'Moreover, we show that CDK regulation promotes net export by phosphorylation of the Mcm3 portion of this module and that nuclear export of the Mcm2-7 complex is sufficient to disrupt replication initiation.'}, {'Alternative Names': 'GST-Mcm3', 'Excerpt': 'One nanogram of purified Cdc28-His6 and 10 ng purified Clb2-MBP (a gift of Jeff Ubersax, Morgan lab, UC San Francisco, CA), mixed in 2 μl of storage buffer (300 mM NaCl, 25 mM HEPES-KOH, pH 7.4, 10% glycerol) for 5 min on ice, were added to 23 μl kinase buffer (50 mM HEPES-KOH, pH 7.4, 2 mM MgCl2, 1 mM dithiothreitol) containing 0.1 mM ATP, 2 μCi [γ-32P]ATP (Amersham, Piscataway, NJ), and 1 μg purified GST-Mcm3, 1 μg purified GST-Mcm3-cdk-5A, or 1 μg purified GST-Mcm3-cdk-7A and incubated at 25°C for 15 min.'}, {'Alternative Names': 'Myc6-Mcm3', 'Excerpt': 'YJL4313, YJL4315, and YJL4324 expressing Myc-Mcm3 were grown in low-phosphate YEPD to OD600 of 0.5-0.8 at 30°C.'}, {'Alternative Names': 'minimal transport module', 'Excerpt': 'Importantly, the Mcm2 NLS and the contiguous Mcm3 NLS and NES behave as a minimal transport module (NLS2-NLS3NES3) that recapitulates the cell cycle-regulated localization of the entire Mcm2-7 complex.'}, {'Alternative Names': 'NLS-NES transport module', 'Excerpt': 'The NLS-NES Transport Module Is a Regulatory Target of CDKs'}]",,Crm1-dependent nuclear export; Leptomycin B (LMB) sensitivity; localization assays; mutagenesis of the leucine-rich motif.,"We also identify a Crm1-dependent nuclear export signal (NES) adjacent to the Mcm3 NLS.; To demonstrate that this cytoplasmic localization was due to net nuclear export during passage through the cell cycle, we introduced the GFP3 fusion construct into cells containing a leptomycin B-sensitive allele of CRM1, crm1-T539C (Neville and Rosbash, 1999).; By the time both cultures had completed S phase (60 min), the GFP3 fusion protein was distributed throughout the cytoplasm in the absence of leptomycin B, but remained strongly nuclear in its presence (Figure 4B).; Thus, the redistribution of this fusion protein from nucleus to cytoplasm is indeed due to nuclear export and is dependent on the Crm1 export receptor as well as the leucine-rich motif.; These results suggest that the Mcm3 NES functions through Crm1 in the full Mcm2-7 complex as it does in the GFP3 fusion protein.; we generated a haploid strain in which the wild-type endogenous MCM3 gene was replaced by a mutant GFP-Mcm3-nes gene, which contains alanine substitutions at the leucine residues of the Mcm3 leucine-rich motif (AQR-RAQAGA).",Mcm3,"We also identify a Crm1-dependent nuclear export signal (NES) adjacent to the Mcm3 NLS.; Mcm3 Contains a Crm1-dependent NES, Which Cooperates with the Mcm2 and Mcm3 NLSs to Form a Cell Cycle-regulated Transport Module","Mcm3 NES (amino acids 790-856), whose activity is dependent on a leucine-rich motif (LQRRLQLGL; amino acids 834-842).","One such motif (LQRRLQLGL; aa 834-842) is present in a 67-amino acid segment (aa 790-856) immediately C-terminal of the Mcm3 NLS segment.; We henceforth refer to the 67-amino acid segment downstream of the Mcm3 NLS as the Mcm3 NES or NES3.; The cytoplasmic localization in nocodazole-arrested cells was dependent on the leucine-rich motif (Figures 1B and 4A).; Thus, the redistribution of this fusion protein from nucleus to cytoplasm is indeed due to nuclear export and is dependent on the Crm1 export receptor as well as the leucine-rich motif.",yes,Based on source directories: {'../src/full_text'},,,Alanine substitutions at the leucine residues of the Mcm3 leucine-rich motif (AQR-RAQAGA) delay nuclear export. Alanine substitutions in the five full CDK consensus sites (mcm3-cdk5A) or four sites flanking the Mcm3 NLS (mcm3-cdk4A) result in constitutive nuclear localization of a GFP3 fusion protein and partial nuclear retention of GFP-Mcm3. A combined mutation of four CDK consensus sites and the leucine-rich motif of the NES (mcm3-cdk4A-nes) completely abrogates net nuclear export.,"we generated a haploid strain in which the wild-type endogenous MCM3 gene was replaced by a mutant GFP-Mcm3-nes gene, which contains alanine substitutions at the leucine residues of the Mcm3 leucine-rich motif (AQR-RAQAGA).; However, the mutant GFP-Mcm3-nes could be detected in the nuclei of virtually all uninucleate budded cells, whereas GFP-Mcm3 could only be detected in the nuclei of 40% of small budded cells and 0% of uninucleate large budded cells (Figure 5A).; Nonetheless, the NES is essential for the timely export of Mcm3, and without this timely export, Mcm3 is not effectively cleared from the nuclei of cycling cells (Figure 5A).; We introduced alanine substitutions in all five full consensus CDK sites or just the four sites flanking the Mcm3 NLS (Figure 1B). ... In contrast, both mutant proteins were constitutively nuclear.; At a metaphase arrest imposed by nocodazole, all three strains displayed partial nuclear retention of their mutant GFP-Mcm3 (Figure 8B), in contrast to wild-type GFP-Mcm3, which showed no such retention (Figure 8C, GFP-Mcm3 and Nguyen et al., 2000).; The mutant Mcm3 expressed in these strains contains alanine substitutions in both the four CDK consensus sites flanking the NLS and the leucine-rich repeat of the NES (Figure 1A). The GFP-Mcm fusion proteins in these strains were strongly nuclear throughout the cell cycle, indicating that the combination of CDK consensus site and NES mutations in Mcm3 could completely abrogate the net nuclear export of Mcm3 and Mcm7 (Figure 9, A and B, last panels and graph).",Saccharomyces cerevisiae,"In Saccharomyces cerevisiae, one of these mechanisms promotes the net nuclear export of a pre-RC component, the Mcm2-7 complex, during S, G2, and M phases.; Yeast Strains, Media, and Growth S. cerevisiae strains used in this study were derivatives of YJL310","CDK consensus phosphorylation sites on Mcm3, located within the NLS-NES transport module. These include five full consensus sites ((S/T)-P-X-(K/R)) at S760, T762, S764, S780, S843, and two degenerate consensus sites ((S/T)-P) at S794, S800. Phosphorylation of these sites promotes net nuclear export.","CDK regulation promotes net export by phosphorylation of the Mcm3 portion of this module; A scan of the amino acid sequences of all six Mcm proteins for the full consensus CDK phosphorylation site (S/T)-P-X-(K/R; Nigg, 1993) only identified two sites on Mcm4 and five sites on Mcm3. The sites on Mcm3 were of particular interest because they are all located within the Mcm3 portion of the NLS-NES transport module (Figure 1A).; Four sites flank the basic region of the Mcm3 NLS, and the fifth site is adjacent to the leucine-rich motif of the Mcm3 NES. Two additional sites that satisfy a more degenerate CDK phosphorylation site consensus ((S/T)-P) are positioned between the basic region and leucine-rich motif.; These results show that Cdc28 promotes the net nuclear export of the GFP3 fusion protein through phosphorylation of the NLS-NES transport module.; We conclude that Cdc28 phosphorylation of NLS-NES module promotes the net nuclear export of the Mcm2-7 complex.",,,,,the NES is not absolutely required for the net nuclear export of Mcm3.,
